<?xml version="1.0"?>
<!DOCTYPE interaction SYSTEM "xmltask.dtd">

<interaction id="toplevel">
	<message>
	Hey, {{ patient.first_name }}! How are you doing?
	</message>
	
	<response pattern="good">
		<message>
		That's great to hear!
		</message>
	</response>
	
	<response pattern="(?P{@cond@}bad|poor|lonely)">
		<message>
		Aww, what's wrong? Why are you {{ match.cond }}?
		</message>
		
		<response pattern=".+">
			<message>Well, I hope you feel better soon!</message>
		</response>
	</response>
	
	<response pattern=".*">
		<message>
		Sorry, I couldn't understand your input ({{ message }}), but try again next time perhaps...
		</message>
		
		<link target="toplevel" />
	</response>
</interaction>