<?xml version="1.0"?>
<!DOCTYPE interaction SYSTEM "xmltask.dtd">

<interaction id="toplevel" prefix="appt">
	<message>
	Hi, {{ patient.first_name }}. You need to schedule a blood test. After you have done so,
	text back the date and time of your test.
	</message>
	
	<response type="date_time" id="requesting_appt">
		<message>
		{% load parse_date %}
		Ur appt is {{ parsed_datetime|relative_date }}. Is this correct? If so, text back "ok". If not, text back date & time again.
		</message>

		<store name="appt_pending" value="{{ parsed_datetime }}" />

		<response pattern="ok">
			<message>
			Thank you. You will be reminded shortly before your appointment.
			</message>

			<schedule task="ex_appt_reminder" date="{{ parsed_datetime }}" offset="1 minute before" />
		</response>

		<response type="date_time">
			<link target="requesting_appt" />
		</response>
	</response>
</interaction>